{
  "$schema": "https://json-schema.org/draft/2020-12/schema",
  "$id": "https://artifact-sdk.dev/schema/1.1/specification/artifact-spec-snapshot.schema.json",
  "title": "ArtifactSpecSnapshot",
  "description": "An immutable copy of a specification revision captured by a host.",
  "type": "object",
  "required": [
    "schemaVersion",
    "sourceSpecId",
    "sourceVersion",
    "key",
    "name",
    "kind",
    "valueType"
  ],
  "properties": {
    "schemaVersion": {
      "$ref": "https://artifact-sdk.dev/schema/1.1/protocol/protocol.schema.json#/$defs/schemaVersion"
    },
    "sourceSpecId": {
      "$ref": "https://artifact-sdk.dev/schema/1.1/protocol/protocol.schema.json#/$defs/artifactSpecId"
    },
    "sourceVersion": {
      "type": "integer",
      "minimum": 1
    },
    "key": {
      "type": "string",
      "minLength": 1
    },
    "name": {
      "type": "string",
      "minLength": 1
    },
    "description": {
      "type": "string"
    },
    "kind": {
      "type": "string",
      "minLength": 1
    },
    "valueType": {
      "$ref": "https://artifact-sdk.dev/schema/1.1/protocol/protocol.schema.json#/$defs/artifactValueType"
    },
    "config": {
      "type": "object",
      "description": "The captured extensible value configuration.",
      "properties": {
        "valueType": {
          "$ref": "https://artifact-sdk.dev/schema/1.1/protocol/protocol.schema.json#/$defs/artifactValueType"
        }
      },
      "additionalProperties": true
    },
    "provider": {
      "$ref": "https://artifact-sdk.dev/schema/1.1/policy/provider-policy.schema.json"
    },
    "requirement": {
      "$ref": "https://artifact-sdk.dev/schema/1.1/policy/requirement-policy.schema.json"
    },
    "lifecycle": {
      "$ref": "https://artifact-sdk.dev/schema/1.1/policy/lifecycle-policy.schema.json"
    },
    "access": {
      "$ref": "https://artifact-sdk.dev/schema/1.1/policy/access-policy.schema.json"
    },
    "privacy": {
      "$ref": "https://artifact-sdk.dev/schema/1.1/policy/privacy-policy.schema.json"
    },
    "validation": {
      "$ref": "https://artifact-sdk.dev/schema/1.1/policy/validation-policy.schema.json"
    },
    "verification": {
      "$ref": "https://artifact-sdk.dev/schema/1.1/policy/verification-policy.schema.json"
    },
    "retention": {
      "$ref": "https://artifact-sdk.dev/schema/1.1/policy/retention-policy.schema.json"
    },
    "presentation": {
      "$ref": "https://artifact-sdk.dev/schema/1.1/policy/presentation-policy.schema.json"
    },
    "metadata": {
      "$ref": "https://artifact-sdk.dev/schema/1.1/protocol/protocol.schema.json#/$defs/artifactMetadata"
    }
  },
  "additionalProperties": true,
  "allOf": [
    {
      "if": {
        "properties": {
          "valueType": {
            "const": "text"
          }
        }
      },
      "then": {
        "properties": {
          "config": {
            "type": "object",
            "properties": {
              "valueType": {
                "const": "text"
              }
            }
          }
        }
      }
    },
    {
      "if": {
        "properties": {
          "valueType": {
            "const": "number"
          }
        }
      },
      "then": {
        "properties": {
          "config": {
            "type": "object",
            "properties": {
              "valueType": {
                "const": "number"
              }
            }
          }
        }
      }
    },
    {
      "if": {
        "properties": {
          "valueType": {
            "const": "boolean"
          }
        }
      },
      "then": {
        "properties": {
          "config": {
            "type": "object",
            "properties": {
              "valueType": {
                "const": "boolean"
              }
            }
          }
        }
      }
    },
    {
      "if": {
        "properties": {
          "valueType": {
            "const": "currency"
          }
        }
      },
      "then": {
        "properties": {
          "config": {
            "type": "object",
            "properties": {
              "valueType": {
                "const": "currency"
              }
            }
          }
        }
      }
    },
    {
      "if": {
        "properties": {
          "valueType": {
            "const": "date"
          }
        }
      },
      "then": {
        "properties": {
          "config": {
            "type": "object",
            "properties": {
              "valueType": {
                "const": "date"
              }
            }
          }
        }
      }
    },
    {
      "if": {
        "properties": {
          "valueType": {
            "const": "datetime"
          }
        }
      },
      "then": {
        "properties": {
          "config": {
            "type": "object",
            "properties": {
              "valueType": {
                "const": "datetime"
              }
            }
          }
        }
      }
    },
    {
      "if": {
        "properties": {
          "valueType": {
            "const": "time"
          }
        }
      },
      "then": {
        "properties": {
          "config": {
            "type": "object",
            "properties": {
              "valueType": {
                "const": "time"
              }
            }
          }
        }
      }
    },
    {
      "if": {
        "properties": {
          "valueType": {
            "const": "location"
          }
        }
      },
      "then": {
        "properties": {
          "config": {
            "type": "object",
            "properties": {
              "valueType": {
                "const": "location"
              }
            }
          }
        }
      }
    },
    {
      "if": {
        "properties": {
          "valueType": {
            "const": "file"
          }
        }
      },
      "then": {
        "properties": {
          "config": {
            "type": "object",
            "properties": {
              "valueType": {
                "const": "file"
              }
            }
          }
        }
      }
    },
    {
      "if": {
        "properties": {
          "valueType": {
            "const": "image"
          }
        }
      },
      "then": {
        "properties": {
          "config": {
            "type": "object",
            "properties": {
              "valueType": {
                "const": "image"
              }
            }
          }
        }
      }
    },
    {
      "if": {
        "properties": {
          "valueType": {
            "const": "video"
          }
        }
      },
      "then": {
        "properties": {
          "config": {
            "type": "object",
            "properties": {
              "valueType": {
                "const": "video"
              }
            }
          }
        }
      }
    },
    {
      "if": {
        "properties": {
          "valueType": {
            "const": "audio"
          }
        }
      },
      "then": {
        "properties": {
          "config": {
            "type": "object",
            "properties": {
              "valueType": {
                "const": "audio"
              }
            }
          }
        }
      }
    },
    {
      "if": {
        "properties": {
          "valueType": {
            "const": "link"
          }
        }
      },
      "then": {
        "properties": {
          "config": {
            "type": "object",
            "properties": {
              "valueType": {
                "const": "link"
              }
            }
          }
        }
      }
    },
    {
      "if": {
        "properties": {
          "valueType": {
            "const": "structured"
          }
        }
      },
      "then": {
        "properties": {
          "config": {
            "type": "object",
            "properties": {
              "valueType": {
                "const": "structured"
              }
            }
          }
        }
      }
    },
    {
      "if": {
        "properties": {
          "valueType": {
            "const": "reference"
          }
        }
      },
      "then": {
        "properties": {
          "config": {
            "type": "object",
            "properties": {
              "valueType": {
                "const": "reference"
              }
            }
          }
        }
      }
    },
    {
      "if": {
        "properties": {
          "valueType": {
            "const": "signature"
          }
        }
      },
      "then": {
        "properties": {
          "config": {
            "type": "object",
            "properties": {
              "valueType": {
                "const": "signature"
              }
            }
          }
        }
      }
    },
    {
      "if": {
        "properties": {
          "valueType": {
            "const": "collection"
          }
        }
      },
      "then": {
        "properties": {
          "config": {
            "type": "object",
            "properties": {
              "valueType": {
                "const": "collection"
              }
            }
          }
        }
      }
    }
  ]
}
